{
  "schemaVersion": 1,
  "id": "municipal-landscape-planting-construction",
  "version": "1.0.0",
  "name": "市政绿化种植与养护",
  "discipline": "landscape",
  "tags": ["planting", "soil", "maintenance"],
  "applicableFactIds": ["entity.landscape"],
  "excludedFactIds": [],
  "requiredFactIds": ["design.plant-list", "design.planting-soil", "site.planting-season"],
  "workflow": [
    { "id": "W01", "name": "种植区域和土壤条件复核" },
    { "id": "W02", "name": "苗木进场验收" },
    { "id": "W03", "name": "种植穴和土壤改良" },
    { "id": "W04", "name": "栽植、支撑和灌溉" },
    { "id": "W05", "name": "养护观察与成活验收" }
  ],
  "controlPoints": [
    { "id": "CP01", "name": "苗木规格和质量", "sourceType": "design", "required": true },
    { "id": "CP02", "name": "种植土和养护要求", "sourceType": "project", "required": true }
  ],
  "laborRoles": ["绿化施工人员", "苗木验收人员", "养护人员"],
  "equipmentTypes": ["苗木运输设备", "起吊设备", "灌溉设备"],
  "qualityEvidence": ["苗木进场验收记录", "种植土检测记录", "栽植记录", "养护记录"],
  "safetyRisks": ["苗木吊装", "机械与人员交叉作业", "高温或低温季节作业"],
  "environmentalControls": ["表土保护利用", "灌溉节水", "枯枝包装分类清运"],
  "sourceRefs": [],
  "prohibitedAssumptions": ["不得替换设计苗木规格", "不得假设土壤改良参数", "不得承诺未经论证的成活率"],
  "reviewStatus": "reviewed",
  "reviewedAt": "2026-09-04"
}
